{
  "schema_version": 1,
  "controller_id": "018f0000-0000-7000-8000-00000000c001",
  "kind": "interactive_client",
  "instance_id": "gul-local-client",
  "subject_id": "local-user",
  "capability": "AAAAAAAAAAAAAAAAAAAAAAAAAAAAAAAAAAAAAAAAAAA",
  "orchestration_launch": {
    "use_case": "dolgorae_orchestrated_session",
    "specialist_policy_name": "personal-alpha-supervised"
  }
}
